<?xml version="1.0" encoding="UTF-8"?>

<menus xmlns:xsi="http://www.w3.org/2001/XMLSchema-instance"
       xsi:schemaLocation="menus.xsd">

    <menu type="Artist.performer" weight="20">
        <contexts>
            <context>Artist</context>
            <context>Release</context>
            <context>Track</context>
        </contexts>
        <labels>
            <label language="EN">Performer: </label>
        </labels>
        <menus>
            <menu type="Release" criteriaDepth="1">
                <menus>
                    <menu type="Track" criteriaDepth="2"/>
                </menus>
            </menu>
        </menus>
    </menu>

    <menu type="Folder" id="performers" weight="20">
        <contexts>
            <context>Classification</context>
        </contexts>
        <labels>
            <label language="EN">Performers</label>
        </labels>
        <menus>
            <menu type="Artist.performer">
                <menus>
                    <menu type="Release" criteriaDepth="1">
                        <menus>
                            <menu type="Track" criteriaDepth="2"/>
                        </menus>
                    </menu>
                </menus>
            </menu>
        </menus>
    </menu>

    <menu type="Artist.composer" weight="25">
        <contexts>
            <context>Artist</context>
            <context>Release</context>
            <context>Track</context>
        </contexts>
        <labels>
            <label language="EN">Composer: </label>
        </labels>
        <menus>
            <menu type="Release" criteriaDepth="1">
                <menus>
                    <menu type="Track" criteriaDepth="2"/>
                </menus>
            </menu>
        </menus>
    </menu>

    <menu type="Folder" id="composers" weight="25">
        <contexts>
            <context>Classification</context>
        </contexts>
        <labels>
            <label language="EN">Composers</label>
        </labels>
        <menus>
            <menu type="Artist.composer">
                <menus>
                    <menu type="Release" criteriaDepth="1">
                        <menus>
                            <menu type="Track" criteriaDepth="2"/>
                        </menus>
                    </menu>
                </menus>
            </menu>
        </menus>
    </menu>

    <menu type="Artist.conductor" weight="25">
        <contexts>
            <context>Artist</context>
            <context>Release</context>
            <context>Track</context>
        </contexts>
        <labels>
            <label language="EN">Conductor: </label>
        </labels>
        <menus>
            <menu type="Release" criteriaDepth="1">
                <menus>
                    <menu type="Track" criteriaDepth="2"/>
                </menus>
            </menu>
        </menus>
    </menu>

    <menu type="Folder" id="conductors" weight="25">
        <contexts>
            <context>Classification</context>
        </contexts>
        <labels>
            <label language="EN">Conductors</label>
        </labels>
        <menus>
            <menu type="Artist.conductor">
                <menus>
                    <menu type="Release" criteriaDepth="1">
                        <menus>
                            <menu type="Track" criteriaDepth="2"/>
                        </menus>
                    </menu>
                </menus>
            </menu>
        </menus>
    </menu>

    <menu type="Release" weight="50">
        <contexts>
            <context>Track</context>
        </contexts>
        <labels>
            <label language="EN">Release: </label>
        </labels>
        <menus>
            <menu type="Track" criteriaDepth="1"/>
        </menus>
    </menu>

    <menu type="Folder" id="releases" weight="50">
        <contexts>
            <context>Artist</context>
            <context>Classification</context>
        </contexts>
        <labels>
            <label language="EN">Releases</label>
        </labels>
        <menus>
            <menu type="Release">
                <menus>
                    <menu type="Track" criteriaDepth="1"/>
                </menus>
            </menu>
        </menus>
    </menu>

    <menu type="Classification.genre" weight="75" playable="false">
        <contexts>
            <context>Artist</context>
            <context>Release</context>
            <context>Track</context>
        </contexts>
        <labels>
            <label language="EN">Genre: </label>
        </labels>
        <menus>
            <menu type="Artist" criteriaDepth="1">
                <menus>
                    <menu type="Release" criteriaDepth="2">
                        <menus>
                            <menu type="Track" criteriaDepth="3"/>
                        </menus>
                    </menu>
                </menus>
            </menu>
        </menus>
    </menu>

    <menu type="Folder" id="moods" weight="75">
        <contexts>
            <context>Artist</context>
            <context>Release</context>
            <context>Track</context>
        </contexts>
        <labels>
            <label language="EN">Moods</label>
        </labels>
        <menus>
            <menu type="Classification.mood" playable="false">
                <menus>
                    <menu type="Artist" criteriaDepth="1">
                        <menus>
                            <menu type="Release" criteriaDepth="2">
                                <menus>
                                    <menu type="Track" criteriaDepth="3"/>
                                </menus>
                            </menu>
                        </menus>
                    </menu>
                </menus>
            </menu>
        </menus>
    </menu>

    <menu type="Folder" id="style" weight="75">
        <contexts>
            <context>Artist</context>
            <context>Release</context>
            <context>Track</context>
        </contexts>
        <labels>
            <label language="EN">Styles</label>
        </labels>
        <menus>
            <menu type="Classification.style" playable="false">
                <menus>
                    <menu type="Artist" criteriaDepth="1">
                        <menus>
                            <menu type="Release" criteriaDepth="2">
                                <menus>
                                    <menu type="Track" criteriaDepth="3"/>
                                </menus>
                            </menu>
                        </menus>
                    </menu>
                </menus>
            </menu>
        </menus>
    </menu>
</menus>